;Unnamed: 0;name;area;min_salary;max_salary;employer;created_at;days_passed;experience;employment;schedule;description;responsibility;requirement;conditions;key_skills
285;285;Инженер-проектировщик АСУ;Тула;45000.0;65000.0;Скома;2019-11-18;16;От 1 года до 3 лет;Полная занятость;Полный день;"СКОМА - динамично развивающаяся инжиниринговая компания, специализирующаяся на оказании услуг в области автоматизации технологических процессов под ключ. Основные направления нашей деятельности:Автоматизация и диспетчеризация пищевых производств;Автоматизация и диспетчеризация химических производств;Автоматизация и диспетчеризация в машиностроении и добывающем комплексе;Автоматизация и диспетчеризация насосных станций, водоподъемов, скважин, систем водоподготовки. Ищем в нашу команду человека, которому интересно заниматься разработкой и внедрением систем автоматического управления технологическими процессами (АСУ ТП) на базе промышленных контролеров. Что будет входить в Ваши обязанности:  Разработка эскизного проекта автоматизации и компоновок шкафов автоматики исходя из технического задания; Разработка спецификаций на комплектные шкафы автоматики, исходя из технического задания на базе промышленных контроллеров (ПЛК), частотно-регулируемых приводов; Разработка спецификации КИПиА исходя из эскизного проекта автоматизации;  Требования:  Желание учиться и развиваться; Навыки работы с AutoCad;   Умение работать в Eplan будет Вашим преимуществом; Знания программно-технического комплекса SIEMENS, Schneider Electric будет Вашим преимуществом; Умение производить выбор электротехнического оборудования, кабельной продукции, КИПиА; Умение производить расчёты нагрузок, токов короткого замыкания, падения напряжения в сетях 0,4 кВ; Готовность работать на результат; Умение документировать результаты своей работы; Уверенный пользователь ПК.  Условия:  Комфортабельный офис; Официальное трудоустройство по ТК РФ; График работы 5/2 с 09.00 до 18.00; Возможна сдельная работа удаленно, либо в офисе; Стабильная и своевременная выплата заработной платы. Размер заработной платы обсуждается с успешным кандидатом Современный компьютер ";Разработка эскизного проекта автоматизации и компоновок шкафов автоматики исходя из технического задания. Разработка спецификаций на комплектные шкафы автоматики, исходя из...;Желание учиться и развиваться. Навыки работы с AutoCad. Умение работать в Eplan будет Вашим преимуществом. Знания программно-технического комплекса SIEMENS...;;"Автоматизация технологических процессов;AutoCAD;Автоматизация;АСУ ТП;Автоматизация производства;КИПиА;Электрические системы и слаботочные системы;ЕСКД;Проектно-конструкторская деятельность;Инжиниринг;автоматика;Шкафы управления;Шкафы автоматики;ePLAN;Autocad Electrical;Caddy;e3.series;САПР;MS Excel;Электрощитовое оборудование;ЧРП;ПЛК;Проектирование шкафов управления;Компас электрик;SolidWorks Electrical;фриланс"
512;512;Руководитель проектов;Нижний Новгород;45000.0;65000.0;Константа;2019-12-02;2;От 1 года до 3 лет;Полная занятость;Полный день;ООО «Константа» – лидирующий поставщик IT-решений для крупных производственных и дистрибьюторских компаний в сфере управления производством, финансами, логистикой и продажами. Предлагаем работу в лучшей компании по внедрению 1С на рынке FMCG. Мы глубоко изучили и накопили экспертизу в отраслевых особенностях работы производителей и дистрибуторов продуктов питания, более 14 лет занимаемся автоматизацией бизнес-процессов таких предприятий. Обеспечиваем высокое качество выполняемых работ и постоянно совершенствуем мастерство сотрудников. Открыта вакансия Руководитель проектов внедрения информационных систем (работа в паре с техническим руководителем). Если ты хочешь управлять проектами, но не имеешь глубоких технических навыков, тогда эта вакансия для тебя. Руководить и управлять нашей талантливой командой разработчиков. Основная функция заключается не в том, чтобы выполнять все задачи самостоятельно, а в том, чтобы наладить благоприятную среду, которая улучшит процесс исполнения и повысит с течением времени его эффективность. Что нужно делать:  Управление процессами и процедурами выполнения работ Управление отношениями с клиентом Обеспечение условий для достижения результатов  А именно:  Планирование и согласование с клиентом работ (объемов, сроков и условий их выполнения) Подготовка материалов для заключения договоров с клиентами Планирование и контроль бюджета проектов Планирование, распределение задач между сотрудниками, контроль выполнения работ (сроков, качества, трудозатрат) Планирование и контроль выполнения работ на стороне клиента Выявления и устранения проблем, препятствующих достижению результатов (для сотрудников и для клиента) Проведение совещаний с командой и клиентом Развитие и мотивация сотрудников  Мы ждем от Вас:  Желательно высшее техническое/математическое образование Опыт руководящей работы от года Желателен опыт работы с 1С Желание развиваться в ИТ сфере Развитые коммуникативные навыки Выраженные «достигаторские» способности  Что мы предлагаем:  Уровень дохода (обсуждается индивидуально с успешным кандидатом в зависимости от опыта и компетенций) Официальное оформление по ТК РФ, белая ЗП Гибкий 40 часовой график работы в удобные интервалы времени Возможность работать удаленно по согласованию с командой Возможность брать административные без бумажной волокиты  Наши преимущества:  Интересная и сложная, или наоборот, сложная, но интересная работа в IT-компании Возможность быстрого карьерного и профессионального роста Регулярное обучение и повышение квалификации от опытных коллег по команде Внешнее обучение за счет компании Уютный стильный офис в верхней части города (автостанция Сенная) Мега-демократичная атмосфера на рабочем месте и отсутствие формальных рамок в общении с коллегами, дружественная и семейная атмосфера Яркая корпоративная культура, в том числе периодические выездные и культурно-образовательные мероприятия Корпоративная библиотека и читательный клуб Киноклуб (просмотр интересных фильмов в нашем кинозале) Занятия спортом на территории офиса (утренняя зарядка, зона для физических упражнений)  Важно: Если Вы считаете, что не по всем параметрам подходите, но хотите заниматься внедрением 1С, присылайте свое резюме. Может быть, именно Вы - тот человек, которого мы ищем!;Управление процессами и процедурами выполнения работ. Управление отношениями с клиентом. Обеспечение условий для достижения результатов. Планирование и согласование с клиентом...;Желательно высшее техническое/математическое образование. Опыт руководящей работы от года. Желателен опыт работы с 1С. Желание развиваться в ИТ...;;
800;800;Верстальщик/Frontend-разработчик;Санкт-Петербург;45000.0;65000.0;Кейклэбс;2019-11-06;28;От 1 года до 3 лет;Полная занятость;Полный день;"Привет! Ищем человека (не обязательно), который применит всю свою магию к безжизненным макетам и реализует прекрасные начинания дизайнеров. Тебя будет любить тестировщик за pixel perfect, заказчики за вау-анимации, а программисты за качество кода. Нам важно:  Портфолио выполненных проектов; Умение верстать с использованием flexbox и grid; Знание БЭМ-методологии; Сборка проекта через gulp/webpack; Препроцессоры sass/less для css, pug для html; Знание принципов mobile first; Умение работать с GIT; Опыт работы с библиотеками для анимаций (gsap, snapsvg и тд); Быстрая работа с Аvocode/Sketch.  Чего у нас нет:  Бюрократии; Работы после 18:30 и на выходных; Дизайнеров, которые не думают про реализацию своих божественных дизайнов:  Чем мы будем интересны тебе? У нас:  Много интересных проектов, дизайнеры не перестают удивлять; График работы 5/2 (7,5 часов+обед), отпуск 4 недели, в котором тебя не тревожат звонками; Лояльное руководство, с которым нет ничего, что нельзя было бы решить; Чудесный офис с чаем, кофе и какао в 2 минутах от Маяковской; Корпоративная библиотека, каллиграфия по пятницам, совместные походы в кино, вечера настолок и корпоративы, которые мы выбираем сами.  Ждем ссылки на гит, на реализованные сайты и готовность сделать небольшое тестовое. До встречи!";Дизайнеров, которые не думают про реализацию своих божественных дизайнов:;Портфолио выполненных проектов. Умение верстать с использованием flexbox и grid. Знание БЭМ-методологии. Знание принципов mobile first. Умение работать с...;;"Наполнение контентом;Копирайтинг;SMM;instagram"
588;588;Веб-дизайнер;Москва;50000.0;65000.0;Drone Sports Global;2019-12-03;1;Нет опыта;Полная занятость;Полный день;Компания RuDroneGroup ищет в команду веб дизайнера, который будет разрабатывать сайты многостранички и лендинги компании с услугами и сервисами. Обязанности:  Разработка сайтов группы компаний Разработка фирменного дизайна и цветов Наполнение порталов контентом Адаптация сайтов под разные форматы устройств Регулярное поддержание ресурсов  Требования:  Релевантный опыт Портфолио работ  Условия:  Гибкий график Интересная отрасль деятельности молодой коллектив ;Разработка сайтов группы компаний. Разработка фирменного дизайна и цветов. Наполнение порталов контентом. Адаптация сайтов под разные форматы устройств. ;Релевантный опыт. Портфолио работ.;;"Adobe Photoshop;Adobe Illustrator;Веб-дизайн;HTML;CorelDRAW;Разработка сайтов"
1883;1883;Программист 1С;Екатеринбург;50000.0;65000.0;Люди Дела;2019-12-02;2;От 1 года до 3 лет;Полная занятость;Полный день;Программист 1С  В IT-отдел производственно-торговой компании требуется Программист-консультант 1С Задачи: · Консультирование пользователей по работе с типовыми и доработанными конфигурациями. Помощь в случаях возникновения ошибок учета. Нахождение оптимального пути исправления ошибок. · Администрирование баз данных (ведение списка пользователей, настройка прав доступа, работа с регламентными заданиями). · Обучение пользователей, разработка инструкций. · Обновление типовых и доработанных конфигураций. · Настройка и сопровождение обменов. · Разработка и настройка отчетов. · Доработка конфигураций, в т.ч. с использованием расширений. Необходимые знания, навыки: · Стаж работы в качестве программиста-консультанта 1С от 2 лет · Понимание основных принципов бухгалтерского, складского и производственного учета · Навыки программирования и конфигурирования на платформе 1С · Умение гибко использовать типовые универсальные отчеты и обработки. · Понимание принципов хранения информации в регистрах учета платформы 1С. · Умение разрабатывать правила обмена с использованием КД 2.0. Приветствуется знание КД 3.0. · Опыт работы в 1С: УТ 11, Бухгалтерия 3.0. Приветствуется опыт в УТП КЗ 2.0, УПП 1.3, КА 2.4 · Приветствуется опыт во франчайзинге. · Будет плюсом наличие сертификатов 1С. Условия: · возможность профессионального роста и совершенствования навыков программирования 1С · з/п 50 000 – 65 000 руб. (в зависимости от уровня кандидата) · готовы рассматривать кандидатов как с небольшим опытом, так и более продвинутых (уровень з/п обсуждается);Консультирование пользователей по работе с типовыми и доработанными конфигурациями. Помощь в случаях возникновения ошибок учета. Нахождение оптимального пути исправления ошибок. ;Необходимые знания, навыки: Стаж работы в качестве программиста-консультанта 1С от 2 лет. Понимание основных принципов бухгалтерского, складского и...;;"1С программирование;1С: Управление Производственным Предприятием;1С: Бухгалтерия;1С: Управление Торговлей"
722;722;Frontend разработчик (ReactJS);Пермь;;65000.0;ЮТИП Технологии;2019-11-18;16;От 1 года до 3 лет;Полная занятость;Полный день;О нас Компания занимается разработкой и продажей программного обеспечения для компаний-брокеров валютного рынка. Мы работаем с клиентами со всего мира. За все время существования компании наш продукт выбрали более сотни компаний, которые сейчас ведут успешный бизнес. Поскольку компания все время расширяется нам нужны хорошие, талантливые разработчики, которые помогут нам решать задачи, которых становится все больше. Мы следим за новыми технологиями, всю разработку ведем через git, используем GitLab, пишем автоматические тесты и стараемся писать хороший, легко читаемый код. Если что-то у Вас не будет получаться - мы всегда поможем. Мы не требуем от кандидата знания и опыта работы со всеми используемыми нами технологиями - всё приходит с опытом! Но желание развиваться профессионально, изучать новое - будет огромным плюсом. Мы собираемся развивать новые направления в работе нашей компании и набираем команду специалистов с опытом разработки   Обязанности специалиста:   Разработка новых продуктов и сервисов компании Разрабатывать компоненты согласно подготовленному дизайну  Требования:  Опыт работы на ReactJS или на других языках от 1 года Базовые знания JavaScript, HTML5, CSS3:  Преимуществом будет:  Опыт работы с системами контроля версий (git)  Что мы предлагаем:  Оформление согласно ТК РФ Работу в молодом и дружном коллективе Перспективы профессионального роста Регулярные корпоративные мероприятия Рабочий день с 9 или 10 часов, сокращенный день в пятницу и обед в любое время. Офис в центре города рядом с набережной реки Кама. Чай, кофе, печенье всегда в наличии ;Разработка новых продуктов и сервисов компании. Разрабатывать компоненты согласно подготовленному дизайну.;Опыт работы на ReactJS или на других языках от 1 года. Базовые знания JavaScript, HTML5, CSS3: Опыт работы...;;"ReactJS;JavaScript;HTML5;CSS3;Git"
