;Unnamed: 0;name;area;min_salary;max_salary;employer;created_at;days_passed;experience;employment;schedule;description;responsibility;requirement;conditions;key_skills
202;202;Программист 1С;Москва;80000.0;100000.0;Полиграф-защита СПб;2019-11-27;7;От 1 года до 3 лет;Полная занятость;Полный день;В компанию по производству полиграфической продукции приглашается программист 1С . Требования:  Высшее образование. Опыт работы не менее года. Знание 1С и опыт программирования. Опыт работы с типовыми конфигурациями Бухгалтерия предприятия 8, Бухгалтерия предприятия 8 КОРП, ЗУП.    Обязанности:  Участие в проектах по автоматизации предприятия на базе 1С: Предприятие 8.2. и 8.3. Консультирование сотрудников по вопросам работы с программным обеспечением. Разработка и постановка технического задания. Выполнение работ по техническому заданию. Поддержка и обновление нетиповых и доработанных конфигураций, написание обработок, отчетов, печатных форм, выгрузка и обмен данными и т.д.  Условия:  График работы с 8.30 до 17.00, сб., вс - выходные М. «Кожуховская» (5 мин. пешком) Уровень заработной платы обсуждается на собеседовании Оформление по ТК РФ ;Участие в проектах по автоматизации предприятия на базе 1С: Предприятие 8.2. и 8.3. Консультирование сотрудников по вопросам...;Высшее образование. Опыт работы не менее года. Знание 1С и опыт программирования. Опыт работы с типовыми конфигурациями Бухгалтерия предприятия...;;"1С программирование;1С: Бухгалтерия;1С: Предприятие 8;1С: Зарплата и управление персоналом;1С: Комплексная автоматизация"
745;745;1С-программист;Самара;80000.0;100000.0;Demis Group;2019-11-18;16;От 3 до 6 лет;Полная занятость;Полный день;"Вакансия открыта в страховой компании АО &quot;СК &quot;Астро-Волга&quot;, входящей в состав группы компаний Demis Group. СК «Астро-Волга» - страховая IT-компания. Мы являемся старейшим страховым частным брендом, стабильно работающим с 1990 года. По данным рейтингового агентства «Эксперт РА» (RAEX) рейтинг «СК «Астро-Волга» на уровне ruBB. По рейтингу установлен стабильный прогноз, что означает высокую вероятность сохранения рейтинга на прежнем уровне в среднесрочной перспективе. На данный момент мы активно развиваем IT-направление нашей компании. Будем рады людям с активной жизненной позицией, способных усилить нашу команду. Цели:   Разработка новых подсистем и модулей под 1С УЦС и 1С АКСИОМА, разработка отчетов и интеграций; Доработка и поддержка обменов с базами РСА; Консультирование сотрудников по вопросам работы с системой 1С.    Что нужно знать и уметь:  Опыт разработки на платформе 1С.8 от 3-х лет (в том числе работа с управляемыми формами, СКД); Разбираться в чужом коде (опыт и желание); Знание механизмов администрирования 1С8; Умение четко выражать свои мысли, а также анализировать и структурировать информацию; Ответственность и нацеленность на результат, внимание к деталям.    Будет плюсом:  Опыт в настройке интеграции 1С с различными системами, в т.ч. с типовыми продуктами 1С (используя web-сервисы, конвертацию данных); Представление о работе страхового бизнеса; Представление о бухгалтерском, налоговом, кадровом учётах и расчете зарплаты; Наличие сертификатов фирмы 1С; Желание совершенствоваться в техническом плане, изучать и применять новые технологии.    Мы предлагаем:  Гибкий рабочий график при 5-дневной рабочей неделе (суббота и воскресенье — выходные дни), а также возможность работы удаленно; Уютный офис, амбициозные задачи, свободу мнений и работу на результат.; Возможность реактивного роста и развития; Индивидуальную систему мотивации; Трудоустройство согласно законодательству РФ или оформление договора ГПХ. ";Разработка новых подсистем и модулей под 1С УЦС и 1С АКСИОМА, разработка отчетов и интеграций. Доработка и поддержка...;Опыт разработки на платформе 1С.8 от 3-х лет (в том числе работа с управляемыми формами, СКД). ;;
901;901;Программист-консультант 1С;Санкт-Петербург;80000.0;100000.0;Аларм-Моторс;2019-11-29;5;От 3 до 6 лет;Полная занятость;Полный день;"Компания «Аларм-Моторс» — лидер автомобильного рынка Санкт-Петербурга приглашает Вас принять участие в конкурсе на вакансию &quot;Программист 1С&quot; открытую в автомобильном холдинге. Обязанности:  Консультации пользователей по конфигурациям 1С; удаленная поддержка пользователей; решение задач по программированию и настройке; изучение, тестирование и обучение пользователей механизмам конфигураций; Выяснение потребностей пользователей и постановка задач по разработке и изменению имеющихся конфигураций.  Требование к кандидатам:  Опыт работы от 3-х лет; Знание платформы 8.3.х (основные механизмы); Знание встроенного языка (начальный уровень); Опыт настройки типовых отчетов и пользовательского интерфейса; Знание основ бухгалтерского учета; Образование - высшее, профильное или смежное; Личные качества: Коммуникабельность, ответственность, желание развиваться в профессиональной области, организованность.  Мы предлагаем:  режим работы: 5/2 с 9.00 до 18.00 или с 10.00 до 19.00 испытательный срок до 3 месяцев зарплата на испытательном сроке 80 000, после прохождения испытательного срока 100 000 руб. официальное трудоустройство : &quot;белая&quot; заработная плата, оплачиваемые отпуска, больничные, оформление по ТК РФ карьерный рост в различных направлениях автохолдинга при наличии открытых вакансий. ";Консультации пользователей по конфигурациям 1С. Удаленная поддержка пользователей. Решение задач по программированию и настройке. Изучение, тестирование и обучение пользователей...;Опыт работы от 3-х лет. Знание платформы 8.3.х (основные механизмы). Знание встроенного языка (начальный уровень). ;;
909;909;PHP-разработчик;Томск;80000.0;100000.0;R-брокер;2019-11-26;8;От 3 до 6 лет;Полная занятость;Удаленная работа;Для работы над крупным проектом требуется PHP-разработчик. Удаленная работа. ФУЛТАЙМ!   Обязанности:  Думать Проектировать Программировать Тестировать свои творения  Требования:  PHP (ООП) Понимание шаблонов проектирования Написание технической документации jQuery (работа с элементами, атрибутами, стилями, ajax) MySQL (CRUD и объединение таблиц обязательно) fireBug (html, сеть, отладка js) Любая IDE: NetBeans,Eclipse phpStorm Умение работать с GIT Пользоваться отладчиком и использовать трассировку (Xdebug) Опыт работы с Yii 1/2 или другими PHP-фреймворками. Внимание! Требуется именно разработчик, а не кодер!  Условия:,  График работы с 10 до 19 Заработная плата от 80 т.р и выше Молодой коллектив, пока небольшой. По результатам работы возможна оплата участия в различных конференциях. ;Думать. Проектировать. Программировать. Тестировать свои творения.;PHP (ООП). Понимание шаблонов проектирования. Написание технической документации. JQuery (работа с элементами, атрибутами, стилями, ajax). MySQL (CRUD и объединение таблиц...;;
1076;1076;Программист PHP;Санкт-Петербург;80000.0;100000.0;Неосвет;2019-11-25;9;От 1 года до 3 лет;Полная занятость;Полный день;"Компания ООО «Медиа Лэнд» работает на рынке хостинговых услуг с 2014 года, и специализируется на предоставлении качественного хостинга на базе виртуальных и выделенных серверов. Философия компании стоит на трех китах: постоянное улучшение оказываемых услуг, стабильность работы проектов, комплексная и оперативная поддержка. Обязанности:  Разработка новых и поддержка существующих web-проектов компании;  Создание простых интерфейсов для пользователей и администраторов.   Требования:  Знание PHP 7+ ; Умение писать нативно без готовых библиотек; Базовые знания HTML, Bootstrap 4, LESS, Jquery; Опыт работы с шаблонизаторами: Twig, Smarty; Разбираться с MySQL, .git, composer, Redis.   Плюсом будет:  Настройка серверов Nginx, Haproxy, Bind, PowerDNS; Наличие портфолио; Умение работать как в команде, так и самостоятельно.  Условия:  График работы: 5/2; Оформление по ТК РФ; Профессиональный молодой коллектив; Офис в 10 минутах ходьбы от метро «Московские ворота»; Чай-кофе, печенье в офисе. ";Разработка новых и поддержка существующих web-проектов компании. Создание простых интерфейсов для пользователей и администраторов.;Знание PHP 7+ . Умение писать нативно без готовых библиотек. Базовые знания HTML, Bootstrap 4, LESS, Jquery. Опыт работы с...;;"MySQL;Git;Nginx;Linux;PHP"
406;406;Технический специалист инженерной сантехники;Москва;100000.0;100000.0;СантехПРО;2019-11-19;15;От 3 до 6 лет;Полная занятость;Полный день;-Составление инструкций (технических паспортов)-Подготовка каталога сантехнических изделий-Описание узлов, агрегатов инженерной сантехники-Знание и опыт работы в сфере инженерной сантехники-Умение работать со схемами и чертежами в специализированных программах Заработная плата 100 000 руб в месяц Для иногородних предоставляется бесплатное жилье  ;Составление инструкций (технических паспортов). -Подготовка каталога сантехнических изделий. -Описание узлов, агрегатов инженерной сантехники.;Знание и опыт работы в сфере инженерной сантехники. -Умение работать со схемами и чертежами в специализированных программах.;;
1736;1736;Ведущий инженер по информационным технологиям и средствам связи;Новый Уренгой;100000.0;100000.0;ПремьерСтройДизайн;2019-12-03;1;От 3 до 6 лет;Полная занятость;Вахтовый метод;"Обязанности: - Поддержание работоспособности парка оборудования ИТ (100 АРМ); - Поддержание работоспособности ЛВС организации; - Поддержание работоспособности серверного оборудования организации; - Составление технической документации; - составление исполнительной документации по ПНР всех систем АСУ; - расчет объемов для составления смет по ПНР АСУ; - ведение нормативно-технической базы ПНР АСУ; - разработка программ производства работ ПНР АСУ; - чтение смет и составление форм КС2, КС6а; - защита выполненных объемов работ перед техническим надзором и «Заказчиком». Требования:   Высшее техническое (либо среднетехническое). В области систем автоматизации либо информационных технологий.   Стаж работы не менее 3-ех лет;   Готовность к вахтовому графику работы (60/30);   Администрирование серверов (файловый, домен, IP-телефония, видеонаблюдения);   Установка и поддержка ОС семейства Windows;   Настройка виртуализации;   Наладка системы резервного копирования и восстановления данных;   Опыт ремонта и обслуживания компьютерной техники и ЛВС;   Опыт построения ЛВС;   Опыт в системном администрировании;   Чтение проектной и сметной документации;   Чтение электрических схем и схем систем автоматизации;   Знание принципов работы оборудования и систем КИП, АСУ, ОПС, АОВ, СС, ЛВС и СПД;   Условия:  Вахтовый метод работы 60/30; Место работы-ЯНАО, Тазовский район, Мессояхское месторождение; Полная оплата проезда (от Вашего места жительства до объекта); Предоставление питания (в столовой), баня, прачечная, спортзал; Перечисление денежных средств на карту Сбербанка (аванс/зарплата), БЕЗ ЗАДЕРЖЕК!!! Официальное трудоустройство. ";Поддержание работоспособности парка оборудования ИТ (100 АРМ). - Поддержание работоспособности ЛВС организации. - Поддержание работоспособности серверного оборудования организации. - Составление технической документации. - ;Высшее техническое (либо среднетехническое). В области систем автоматизации либо. Информационных технологий. Стаж работы не менее 3-ех лет. ;;"Системы видеонаблюдения;Администрирование серверов Windows;Active Directory;Настройка серверов;AutoCAD"
55;55;Менеджер проектов web разработка;Москва;;100000.0;Астони;2019-12-02;2;От 1 года до 3 лет;Полная занятость;Полный день;"Astoni - это опытная и слаженная веб-команда, которой доверяют ведущие компании РФ.Мы успешно выполняем задачи наших клиентов по созданию, развитию и поддержке сайтов, а так же, разрабатываем уникальный и продающий веб-дизайн.В связи с расширением штата, мы приглашаем в команду системного и ответственного Менеджера проектов, умеющего получать удовольствие от собственного успеха и успеха своей команды! Обязанности:  составление четкого и понятного ТЗ; организация работы тех. специалистов (программисты, дизайнеры), обеспечение команды актуальной информации по проекту; администрирование и контроль всех этапов работы над проектом: правки, согласование, сроки сдачи; коммуникация с клиентом, обсуждение административных вопросов, информирование о стадии проекта, презентация промежуточных вариантов; развитие и поддержка сайтов текущих клиентов; ведение отчетности, работа с crm Битрикс24.  Требования к кандидату:  опыт работы Проект-менеджером в IT среде - от 1 года; практический опыт составления ТЗ для программистов и дизайнеров; понимание всех этапов веб-разработки с нуля и до полной сдачи проекта; грамотная устная и письменная речь; пунктуальность, умение работать в команде, доброжелательность.  Мы предлагаем:  полную занятость в нашем офисе; график работы 5/2 с 9:00 до 18:00; прогрессирующую заработную плату до 100 000 рублей в месяц (оклад+премии, по результатам собеседования); мы рассматриваем иногородних кандидатов с целью переезда в Москву - по предварительному собеседованию в skype с руководителем.  Наши преимущества:  возможность расти и реализовываться в IT сфере; сформированная, профессиональная и отзывчивая команда; удобное расположение офиса (в 5 минутах от м. Курская); повышение уровня зп согласно прогрессу на текущей должности.  Если Вы разделяете наши ценности, готовы развиваться и получать интересный опыт - мы ждем Ваше резюме!";Составление четкого и понятного ТЗ. Организация работы тех. специалистов (программисты, дизайнеры), обеспечение команды актуальной информации по проекту. Администрирование и контроль...;Опыт работы Проект-менеджером в IT среде - от 1 года. Практический опыт составления ТЗ для программистов и дизайнеров. ;;
