;Unnamed: 0;name;area;min_salary;max_salary;employer;created_at;days_passed;experience;employment;schedule;description;responsibility;requirement;conditions;key_skills
1624;1624;Разработчик php (Битрикс);Москва;100000.0;150000.0;Консист-ОС;2019-11-20;14;От 3 до 6 лет;Полная занятость;Полный день;"Обязанности:   Сбор и анализ требований заказчика к разработке и модификации приложений на платформе Битрикс, оценка реализуемости и трудозатрат;   Разработка, настройка и адаптация модулей с использованием объектной модели Битрикс;   Настройка модулей, подсистем и механизмов интеграции;   Разработка и сопровождение решений на платформе Битрикс;   Администрирование порталов на платформе Битрикс;   Поддержка приложений, устранение ошибок в установленные сроки (SLA);   Участие в написании технической и пользовательской документации по выполненным разработкам;   Участие в тестировании реализованных web приложений, ввод в эксплуатацию;   Требования:    Высшее техническое/экономическое, желательно - в области информационных технологий; Опыт работы по профилю от 3-х лет;  Знание: php 7+, 1C-Bitrix, My sql, CSS, HTML, JAVASCRIPT, jquery;   Опыт разработки и поддержки проектов на 1C-Bitrix не менее 2 лет;   Разработки кастомных модулей 1C-Bitrix;   Написания аккуратного кода, необходимо следить за его качеством и соответствием стандартам;   Умение работать в команде, принимать и приводить аргументы, мыслить системно; Плюсом будет: Наличие сертификатов 1C-Bitrix (преимущество имеющим сертификат «Разработчик Bitrix Framework»); Навыки Front-end (предпочтительно React); Администрирование Linux;   Условия:  Оформление согласно ТК РФ Стабильная заработная плата Годовая премия Социальная программа (ДМС) Возможности для профессионального и карьерного роста; слаженная команда, работающая на общий результат Постоянное повышение профессионального уровня, обучение Современный офис - м.Технопарк ";Сбор и анализ требований заказчика к разработке и модификации приложений на платформе Битрикс, оценка реализуемости и трудозатрат. Разработка, настройка и...;Высшее техническое/экономическое, желательно - в области информационных технологий. Опыт работы по профилю от 3-х лет. Знание: php 7+...;;"JavaScript;jQuery;CSS;HTML;1С-Битрикс"
1706;1706;QA Automation Engineer;Санкт-Петербург;100000.0;150000.0;B2Broker;2019-12-03;1;От 1 года до 3 лет;Полная занятость;Полный день;"Международная компания B2Broker — это финтех, разработчик и провайдер технологий для брокерских компаний, банков и инвестиционных фондов. Мы не занимаемся брокерской деятельностью — но предлагаем законченные решения для других компаний. Чем нужно будет заниматься:  Разрабатывать, сопровождать и анализировать автотесты; Поддерживать стабильную работу ряда успешно функционирующих web и мобильных приложений.  Мы ожидаем от Вас:  Опыт работы от 2-х лет по специальности; Высшее техническое образование; Опыт работы с командной строкой linux; Знание SQL; Обязательно знание любого языка программирования и готовность писать автотесты на java; Понимание процессов тестирования, желание развиваться в этом направлении; Опыт работы с баг-треккинговыми системами.  Будет плюсом:  опыт написания автотестов; опыт тестирования веб-приложений; опыт проведения нагрузочного тестирования.  Мы предлагаем:  оформление по ТК РФ; возможность практики английского языка прямо в офисе; неограниченный профессиональный рост и возможность работать в развивающейся международной компании; ресурсы на реализацию смелых идей; работу по гибкому графику в уютном офисе в центре города. ";Разрабатывать, сопровождать и анализировать автотесты. Поддерживать стабильную работу ряда успешно функционирующих web и мобильных приложений.;Опыт работы от 2-х лет по специальности. Высшее техническое образование. Опыт работы с командной строкой linux. Знание SQL. ;;"Java;SQL;Тестирование"
1946;1946;Full stack developer (middle);Москва;100000.0;150000.0;Вип Групп Аэро;2019-11-25;9;От 3 до 6 лет;Полная занятость;Полный день;Обязанности:  Закрывать задачи по Back End и Front End, Devops на нескольких проектах внутри компании. Участвовать в построении внутренней IT архитектуры приложений, сайтов, сервисов компании. Взаимодействие с менеджером проектов и внешними IT подрядчиками. Поддержка и доработка существующего кода. Разработка нового функционала.  Требования:  PHP C# Опыт работы с фреймворком: Yii2, NET Framework Знание MySQL (индексы, запросы) Опыт написание api и бэкенда для Web сервисов Знание Git Базовые знания html, css, java. Верстка Навыки Devops (базовое управление сервером). Высокая ответственность и внимательность к деталям  Условия:  Офис в центре Москвы Оплачиваемые обеды дружный молодой коллектив оформление по ТК ;Закрывать задачи по Back End и Front End, Devops на нескольких проектах внутри компании. Участвовать в построении внутренней IT архитектуры...;PHP. C#. Опыт работы с фреймворком: Yii2, NET Framework. Знание MySQL (индексы, запросы). Опыт написание api и бэкенда для...;;"Git;MySQL;CSS;Yii;HTML;PHP5;С#;.NET Framework"
1668;1668;Full stack разработчик;Москва;115000.0;150000.0;Первый Бит;2019-11-25;9;От 3 до 6 лет;Полная занятость;Полный день;В связи с расширением одного из направлений мы ищем Full Stack разработчика   От нас:  Постоянная занятость, всегда есть проекты Грамотная постановка задач - не нужно в постоянном режиме работать над несколькими проектами одновременно Надёжность не на словах, а на деле Мы ценим Ваш опыт работы, поэтому готовы обсуждать Ваши ожидания по заработной плате Формат работы (гибкий график, удалённая работа) обсуждается индивидуально    Задачи:  Разработка личного кабинета клиента (back и front) Интеграция личного кабинета с внутренними сервисами компании Интеграция с внешними сервисами Участие в проработке технических решений    Что ожидаем от Вас: Обязательно:  Опыт разработки на Python с использованием одного из веб-фреймворков: Django, Flask, Tornado Опыт разработки приложений с нуля и до запуска в production Опыт разработки и сопровождения API Уверенная работа с Git  Будет плюсом:  Опыт работы с React / Vue / Angular Опыт работы с Linux и Docker Навыки работы с чистыми SQL ;Разработка личного кабинета клиента (back и front). Интеграция личного кабинета с внутренними сервисами компании. Интеграция с внешними сервисами. ;Опыт разработки на Python с использованием одного из веб-фреймворков: Django, Flask, Tornado. Опыт разработки приложений с нуля и до...;;"Python;JavaScript;Django;React;Rest API"
853;853;Разработчик 1С;Москва;140000.0;150000.0;Бонолит - Строительные решения;2019-12-03;1;От 3 до 6 лет;Полная занятость;Полный день;"Обязанности: Ведение разработки на платформе 1С 8.3 (1C ERP, УТ): разработка и внедрение новых механизмов; Поддержка обмена между узлами РИБ и центральным узлом 1С ERP; Разработка механизмов обмена между сайтом и УТ (участие в новом проекте); Обновление доработанных конфигураций на новые релизы 1С; Ведение технической документации. Требования: Отличное знание механизмов платформы, в том числе РИБ, web-сервисы, XDTO, СКД; Опыт разработки механизмов обмена в форматах xml, json; Опыт работы с 1С Конвертация данных; Знание механизмов администрирования 1С и MS SQL; Приветствуется знание подсистем БНУ и ЗУП в 1С ERP. Условия: Все социальные гарантии, предусмотренные ТК, &quot;белая&quot; заработная плата. Уровень заработной платы обсуждается с успешным кандидатом. Работа в крупной группе компаний, перспективы развития. Место работы: Московская область, Ногинский район, г. Старая Купавна (35 км. от МКАД).";Ведение разработки на платформе 1С 8.3 (1C ERP, УТ): разработка и внедрение новых механизмов. Поддержка обмена между...;Отличное знание механизмов платформы, в том числе РИБ, web-сервисы, XDTO, СКД. Опыт разработки механизмов обмена в форматах xml, json. ;;"1С: Управление Торговлей;1С программирование;XML;1С: Торговля;MS SQL"
969;969;Ведущий разработчик (PHP/Full stack);Санкт-Петербург;150000.0;150000.0;PROACTION;2019-11-23;11;От 3 до 6 лет;Полная занятость;Полный день;"Компания Proaction разрабатывает онлайн-сервис proaction.pro по оценке соискателей и сотрудников. Чтобы оценка была качественной, система автоматически учитывает множество параметров: поведенческие факторы кандидатов, стили управления руководителей в компании, и даже корпоративные ценности.Это позволяет с помощью небольшого онлайн-тестирования убедиться, что желания соискателя и запросы компании будут сочетаться на 100%.Текущая версия нашего продукта развивается 3 года.За это время мы вошли в число лидеров рынка онлайн-оценки персонала, и мы уже задаём тренды в отрасли. Нашими клиентами являются Альфа-банк, Сбербанк, Мегафон, Перекресток, Спортмастер и еще 400 других компаний.Наши основные направления работы на следующие полгода:  полная переработка интерфейса на современных технологиях, со встроенным обучением для новых пользователей; обработка резюме natural language processing; data mining по отчетам о KPI сотрудников для уточнения профиля должности и поиска проблемных мест; новые каналы доставки сообщений и чат-боты.  Стек технологий: PHP (Yii 2), MySQL, Redis, Angular. Дизайн и верстку мы отдаем на аутсорс.Работаем над кодом в Git, проводим код-ревью, внедряем автотесты.Мы следим за качеством кода, работаем с разумными дедлайнами и предотвращаем «пожары» до их возникновения.У нас не придется переключаться в новый проект, чтобы срочно разобраться в спагетти, оставшемся от предыдущего разработчика, или срочно выделять место для анимированного баннера в личном кабинете.Но при этом мы избавлены и от частых недостатков B2B: бизнес-задачи не меняются посреди разработки (в бэклоге задачи появляются по актуальным запросам пользователей), а требования продуманные и понятные (в руководстве люди с высшим техническим образованием). Требования к кандидату:  Опыт разработки сайтов или веб-приложений на PHP как минимум 2-3 года; Знакомство с одним из PHP-фреймворков, знание и умение применять ООП и MVC; Знание языка SQL и реляционных баз данных; Знание и опыт работы с Git; Знание HTML, CSS и Javascript (мы используем Twitter Bootstrap 3 и Material Design).  Плюсом будет:  Опыт работы с PHP 7 и знание его преимуществ; Опыт работы с фреймворком Yii 2.0; Знание REST/SOAP, опыт интеграции с различными RESTful API; Знание и опыт работы с Less/SASS; Опыт работы с Angular или Vue; Опыт чтения и модификации чужого кода.  Обязанности и условия:  Разработка и сопровождение онлайн-сервиса Proaction. Участие в обсуждение бизнес-задач. Поиск оптимальных путей рещения. Полный рабочий день, для кандидатов из Санкт-Петербурга работа в офисе (метро Петроградская) с возможностью брать дни для работы из дома. Для кандидатов из регионов полностью удаленная работа, возможна помощь с переездом. Гибкий график. Испытательный срок 2 месяца. ";Полная переработка интерфейса на современных технологиях, со встроенным обучением для новых пользователей. Обработка резюме natural language processing. Data mining по...;Опыт разработки сайтов или веб-приложений на PHP как минимум 2-3 года. Знакомство с одним из PHP-фреймворков, знание...;;"MySQL;Yii;PHP;Redis"
23;23;DevOps инженер;Москва;;150000.0;Артлоджик;2019-12-01;3;От 1 года до 3 лет;Полная занятость;Удаленная работа;"Если ты опытный DevOps инженер мы приглашаем тебя в команду разработки Pooling.me. Pooling.me — это уникальный сервис, который меняет рынок коммерческих грузоперевозок в России. На площадке Pooling.me производители товаров могут объединяться при доставке своих товаров и за счет этого экономить до 30%. Как BlaBlaCar, только в логистике. Pooling.me несет огромную ценность для своих клиентов, и в пользу этого говорят цифры - за первые полгода работы площадки к нам подключилось более 100 компаний, среди которых многие крупнейшие бренды (Johnson&amp;Johnson, Loreal, Bacardi, Colgate и прочие). Еженедельно через площадку отгружается более 150 машин. Показатель оттока клиентов составляет менее 2% - попробовав работать на площадке один раз, компании делают это регулярно. Благодаря нам небольшие производители товаров получают возможность доставлять свои товары в другие регионы и повышать продажи. Ежедневно наши системы обрабатывают сотни перевозок и обеспечивают взаимодействие отделов логистики, складов, транспортных компаний и клиентов наших заказчиков. Благодаря продуктам Artlogic наши заказчики экономят сотни тысяч рублей, полностью контролируют свою логистику и обеспечивают высокий уровень клиентского сервиса. Мы ждем от тебя:   Практический опыт администрирования Linux, Windows   Понимание процессов CI/CD, опыт их реализации на Jenkins/TeamCity/Gitlab Runner   Умение обращаться с системами мониторинга (Prometheus, Grafana, Zabbix) и логирования (ElasticSearch + Kibana)   Опыт работы с базами данных (MSSQL, PostgreSQL, MySQL, MongoDB)   Опыт работы с экосистемой Docker (OpenShift, Kubernetes)   Опыт балансировки нагрузки (Nginx)   Владение bash, powershell   Мы предлагаем:  Работа в офисе (напротив Москва-сити) или удаленно Дружный коллектив, отсутствие бюрократии, встречи всей командой в Москве раз в год Гибкий график Оплачиваемый отпуск и больничный Agile, ретроспективы, все по правилам.  В процессе работы ты будешь заниматься следующими задачами:   Построение инфраструктуры и обеспечение её бесперебойной работы   Эксплуатация, мониторинг production-систем   Внедрение и поддержка CI/CD-процессов   Участие в оптимизации существующих и проектировании новых технических решений   Помощь разработчикам в развертывании веб-проектов  ";Построение инфраструктуры и обеспечение её бесперебойной работы. Эксплуатация, мониторинг production-систем. Внедрение и поддержка CI/CD-процессов. Участие в оптимизации...;Практический опыт администрирования Linux, Windows. Понимание процессов CI/CD, опыт их реализации на Jenkins/TeamCity/Gitlab Runner. Умение обращаться с...;;"Linux;Jenkins;TeamCity;Zabbix;MS SQL;PostgreSQL;MySQL;MongoDB;Nginx"
