;Unnamed: 0;name;area;min_salary;max_salary;employer;created_at;days_passed;experience;employment;schedule;description;responsibility;requirement;conditions;key_skills
25;25;Product Owner;Москва;;;Сбербанк;2019-11-28;6;От 3 до 6 лет;Полная занятость;Полный день;У вас есть шанс в составе команды SberDevices стать создателем нового устройства и поучаствовать в полном цикле рождения уникального в своем роде продукта для многомиллионной аудитории B2C и B2B продуктов: от реализации идеи до внедрения и последующего развития   Задачи:  Выступать в роли евангелиста продукта как для внутренних команд так и для внешних подрядчиков Быть ответственным за запуск продукта и стратегию выведения продукта на рынок Стратегия и запуск покрывает все аспекты взаимодействия с вовлеченными командами для успешного запуска продукта Взаимодействие с командами для достижения поставленных целей, отслеживая возникающие проблемы и предпринимая меры для их решения Анализ существующих продуктов на предмет возможности расширения функциональных свойств Определение и приоритизация потребностей пользователей    Требования:  Способен организовать работу над продуктом вместе со смежными командами Готов проводить большое количество исследований и экспериментов Способен к поиску инновационных решений и внедрению новых технологий Умеет анализировать тенденции и рынок Обладает навыком формирования видение развития продукта продуктового бэклога Обладает стремлением все проверять на цифрах    Условия  Профессиональный рост в команде дружных профессионалов. Профессиональное обучение, семинары, тренинги, конференции, корпоративная библиотека. ДМС, страхование жизни. Самые инновационные, амбициозные проекты и задачи. Свободный дресс-код. Гибкий график для оптимального баланса работы и личной жизни. Льготные кредиты и корпоративные скидки. Конкурентная компенсация (оклад и премии по результатам деятельности). ;Выступать в роли евангелиста продукта как для внутренних команд так и для внешних подрядчиков. Быть ответственным за запуск продукта и...;Способен организовать работу над продуктом вместе со смежными командами. Готов проводить большое количество исследований и экспериментов. Способен к поиску инновационных...;;
396;396;Product Owner;Москва;;;Сбербанк;2019-11-22;12;От 3 до 6 лет;Полная занятость;Полный день;"Добрый день! Компания «Сбербанк», блок Технологии сейчас в поисках специалиста на позицию Product Owner&#39;a. Мы ищем опытного менеджера продукта с глубокой технической экспертизой в кластер продуктов для разработчиков департамента SberDevices. У вас есть шанс поучаствовать в создании новых продуктов, основанных на голосовых технологиях, обработке естественного языка и машинном обучении. Какие задачи необходимо будет реализовывать:  Планировать развитие продукта для разработчиков (vision/roadmap/marketing); Определять и валидировать гипотезы; Формировать и актуализировать бэклог продукта; Постоянное взаимодействовать с командой разработки, контролировать сроки и качество реализации задач;  Мы хотим видеть в кандидате:  Опыт управления техническим продуктом или проектом – от двух лет; Опыт работы программистом от 1 года; Опыт работы с классическими IDE, системами контроля версий, развёртывания и другими инструментами разработки; Понимание основ машинного обучения; Приветствуется опыт мобильной разработки или управления разработкой под мобильные платформы.  Мы ценим своих сотрудников и предлагаем:  Обучение в корпоративном университете; Возможность посещения (как в качестве слушателя, так и в качестве выступающего) всероссийских и международных IT-конференций; ДМС для сотрудников и скидки на медицинскую страховку для родственников; Работа в команде профессионалов, возможность разрабатывать уникальные и крупные проекты масштаба нашей страны; Большой и комфортный офис со спортзалом, библиотекой, столами для пинг-понга, кафе для сотрудников; Широкий спектр дисконт–программ, скидок и привилегий от компаний-партнеров; Льготное кредитование в Сбербанке – возможность пользоваться премиальными продуктами Банка на специальных условиях. ";Планировать развитие продукта для разработчиков (vision/roadmap/marketing). Определять и валидировать гипотезы. Формировать и актуализировать бэклог продукта. Постоянное взаимодействовать с...;Опыт управления техническим продуктом или проектом – от двух лет. Опыт работы программистом от 1 года. Опыт работы с классическими IDE...;;Опыт в IT
534;534;Product Owner;Москва;;;СМАРТ ЛАЙТ СОЛЮШНС;2019-12-02;2;От 3 до 6 лет;Полная занятость;Полный день;"Описание продукта / компании  Компания «Smart Light Solutions» – предлагает решения в области городских инновационных технологий мониторинга объектов ЖКХ для контроля эффективного использования энергоресурсов, оптимизации эксплуатационных затрат на промышленных и социально-значимых объектах. «SLS» специализируется на комплексных инвестиционных проектах в области энергосбережения, повышения энергоэффективности, ИТ, ЖКХ и экологии. Компания предоставляет собственные решения для управления городскими процессами, внедряя современные технологии «умного» города на территории РФ.   Обязанности:  Выявление, проработка, и приоритизация требований совместно с внутренним заказчиком; Анализ и четкое понимание потребностей пользователей на разных этапах развития продукта Коммуникация с архитектором для оформления требований user stories и технических задач в product backlog Выстраивание прозрачных процессов сбора требований разработки и поставки, контроль за сроками и качеством Реализация процесса производства качественного UX Формирование ключевых показателей эффективности продукта Обеспечение процесса взаимодействия со смежными подразделениями компании и поставщиков в рамках своих задач Приемка и валидация результатов Проективное формирование предложений по совершенствованию продукта  Требования:  Подтвержденные кейсы создания успешных цифровых продуктов с нуля; Опыт формализации функциональных требований и технических заданий; Понимание построения UX решений с большим количеством пользователей; Умение составлять бэклог, определять приоритеты и оценивать эффект; Опыт работы с подрядчиками для внедрения it-решений; умение работать самостоятельно и готовность нести ответственность за KPI продукта; Развитые коммуникационные навыки и способность; Умение разбираться в новых предметных областях и достигать глубокого понимания потребностей клиентов и умение их формализовать; Успешный опыт работы в команде; Лидерские качества, нацеленность на результат и высокая самоотдача.  Условия   Заработная плата по результатам собеседования; Возможность работать в инновационном подразделении крупнейшей частной инвестиционной компании; Оформление согласно КЗоТ РФ; Возможность влиять на развитие продукта и видеть результат; Комфортный офис в 10-15 минутах ходьбы от метро «Калужская».   ";Выявление, проработка, и приоритизация требований совместно с внутренним заказчиком. Анализ и четкое понимание потребностей пользователей на разных этапах развития продукта. ;Подтвержденные кейсы создания успешных цифровых продуктов с нуля. Опыт формализации функциональных требований и технических заданий. Понимание построения UX решений с...;;"Управление проектами;Оптимизация бизнес-процессов;Управление командой;Ориентация на результат;Управление отношениями с клиентами"
828;828;Product Owner;Москва;;;Банк Открытие;2019-11-07;27;От 1 года до 3 лет;Полная занятость;Полный день;"Обязанности:  Взаимодействие с командой разработки в качестве владельца продукта «Пассивы» (срочное размещение, остатки на счетах, инвестиции); Участие в формировании продуктовой стратегии по своему направлению (в разрезе ДБО и иных каналов); Управление продуктовым бэклогом (в т.ч. инициация и приоритизация всех инициатив); Проведение глубинных интервью с клиентами, конкурентный анализ по направлению, постановка задач на дизайн и разработку; Выстраивание CJM по продукту в Digital-каналах (от MVP до полноценных продуктовых и сервисных решений); Формулирование ключевых показателей и метрик продукта в целом и его отдельных частей; Выстраивание аналитических процессов от конкурентного анализа при проработке CJM до post-анализа внедренной в эксплуатацию функциональности/процесса; Мониторинг обратной связи от клиентов (все возможные каналы и источники); Мониторинг достижения целей по реализованной функциональности и бизнес-плану.  Требования:  Высшее образование; Опыт работы владельцем продукта и глубокое понимание обязанностей PO (опыт от 1 года); Опыт управления проектами/командами в рамках гибкой методологии разработки (Agile); Умение разговаривать с дизайнерами, аналитиками и IT-специалистами на одном языке; Опыт долгосрочного планирования развития проекта/продукта, оценки ресурсов, прогнозирования, управления бэклогом; Знание принципов создания и управления Digital-продуктами.  Мы предлагаем Вам:  Стать частью крупного, динамично развивающегося банка; Работу в команде единомышленников, неравнодушных к передовым технологиям и практикам; Неограниченные возможности для совершенствования Ваших навыков и знаний, обучаясь у лучших и решая сверхамбициозные задачи; Позитивную рабочую атмосферу, дружный коллектив; Удобное расположение офисов в центре Москвы; Достойную и конкурентную заработную плату, квартальные и годовые премии, размер которых зависит от результатов Вашей работы; Разнообразный социальный пакет: ДМС, страхование жизни, страхование для выезжающих за границу, льготные условия приобретения банковских продуктов, скидки в фитнес-клубах и в компаниях-партнерах. ";Взаимодействие с командой разработки в качестве владельца продукта «Пассивы» (срочное размещение, остатки на счетах, инвестиции). Участие в формировании продуктовой стратегии...;Высшее образование. Опыт работы владельцем продукта и глубокое понимание обязанностей PO (опыт от 1 года). Опыт управления проектами/командами в...;;"Agile Project Management;Бизнес-анализ;MS PowerPoint;MS Project;Прогнозирование;Разработка продукта;Управление проектами;Планирование"
1563;1563;Product Owner;Москва;;;Сбербанк;2019-11-29;5;От 3 до 6 лет;Полная занятость;Полный день;"Функции:Управление командой или командами, которые реализуют продукт по ботам: от идеи, до внедрения в продакшен и поддержку;Разработка продуктового видения по ботам: чат-бот или голосовой ассистент;Управление бэклогом проедукта, приоритезация фич, детализация до пользоватеских историй;Анализ клиентской базы, сегментация клиентов;Организация процесса клиентского тестирования: как качественного, так и количественного, а также проведение А/Б-тестов;Выстраивание отчетности;Участие в разработке архитектуры решения;Презентация статуса на регулярных встречах руководству.Необходимые навыки и опыт работы:Опытом разработки пользовательских продуктов. В идеале - ботов от 3х лет в роли Product Owner;Опыт работы с продуктами с использованием AI;Опыт выстраивания команды и мотивации на достижение результата;Умение приоритизировать задачи держать фокус на главном;Понимание продуктовых метрик и расчетов unit экономики;Умение поставить себя на место клиента, проверить свои гипотезы с клиентами; Отличный новый офис «Sbergile Home» в шаговой доступности от ст. Кутузовская (метро и МЦК);Самые инновационные и амбициозные проекты и задачи.Профессиональное обучение, семинары, тренинги, конференции.ДМС, сниженные ставки по кредитованию, программы лояльности для сотрудников.Бесплатный фитнес-зал на территории офиса.";Управление командой или командами, которые реализуют продукт по ботам: от идеи, до внедрения в продакшен и поддержку. Разработка продуктового видения...;Опытом разработки пользовательских продуктов. В идеале - ботов от 3х лет в роли Product Owner. Опыт работы с продуктами с...;;
1646;1646;Product Owner;Москва;;;КИВИ БАНК;2019-12-03;1;От 3 до 6 лет;Полная занятость;Полный день;"Проект Совесть два года назад запустил первую в стране карту рассрочки, а сегодня ее каждый месяц хотят получить уже 500 000 человек. Мы за 2,5 месяца построили полноценный розничный банк &quot;с нуля&quot;, охватили более 1000 городов России. Дальше - Больше! Чем предстоит заниматься:  Управление ожиданиями и работа с обратной связью заказчиков, пользователей и заинтересованных лиц; Анализ потребностей заказчиков и пользователей, разработка прототипов интерфейсов; Создание, ведение и приоритизация продуктового бэклога; Отслеживание показателей успешности продукта, принятие решений на основании измерений; Быстрая проверка продуктовых гипотез; Планирование релизов продукта, управление сроками и качеством реализации; Приемка результатов работы команды разработки.  Как понять, что вы нам подходите:  У вас есть опыт разработки технологических продуктов и их вывода на рынок; Вы обладаете хорошими аналитическими навыками, быстро обучаетесь и умеете ставить себя на место пользователя; Вы умеете раскладывать то, что нужно сделать на небольшие ценные части, которые можно быстро реализовать; Вы не расстраиваетесь, когда оказывается, что пользователю было нужно что-то совсем другое; Вы отлично пользуетесь различными аналитическими инструментами и умеете измерять результат своих работ; Умеете договариваться с людьми, не давя на них; Вы хорошо понимаете, что такое Agile, как это работает и имеете опыт работы в подобных средах.  Будет совсем хорошо, если:  Вы имеете опыт работы в финансовых компаниях; Impact Mapping и Story Mapping — ваши основные рабочие инструменты; Вы знаете основы Usability.  Что мы предлагаем:  Дружный коллектив, адекватный менеджмент, отсутствие бюрократии; Возможность профессионального и карьерного роста; Работа в команде с профессионалами над сложными и интересными задачами, в продуктовых командах; Оформление по ТК РФ, конкурентоспособная заработная плата, премии по результатам работы; Расширенный соц. пакет: компенсация питания, ДМС, скидка на фитнес сотрудникам компании; Уютный и современный офис в 10 минутах ходьбы от м.Чертановская. ";Управление ожиданиями и работа с обратной связью заказчиков, пользователей и заинтересованных лиц. Анализ потребностей заказчиков и пользователей, разработка прототипов интерфейсов. ;У вас есть опыт разработки технологических продуктов и их вывода на рынок. Вы обладаете хорошими аналитическими навыками, быстро обучаетесь и...;;"Работа в команде;Планирование;Аналитическое мышление;Планирование карьеры;Работа с людьми"
