;Unnamed: 0;name;area;min_salary;max_salary;employer;created_at;days_passed;experience;employment;schedule;description;responsibility;requirement;conditions;key_skills
1815;1815;Frontend-разработчик (React);Екатеринбург;50000.0;100000.0;Дорожный консалтинг;2019-11-11;23;От 1 года до 3 лет;Полная занятость;Полный день;Привет! Сначала — несколько слов о том, чем мы занимаемся. Наша работа связана с автомобильными дорогами и тем, что их окружает. На любой дороге установлено различное оборудование (дорожные знаки, светофоры, наружная реклама, ограждения и многое другое), которое требуется регулярно обслуживать — чинить, менять, приводить в соответствие новым требованиям. В масштабах большого города это превращается в очень сложную задачу — количество объектов исчисляется сотнями тысяч. Чтобы справиться с такой задачей, прежде всего нужно знать, где установлено оборудование, в каком оно состоянии и какие у него характеристики. Именно эту проблему мы и научились решать: разработали свою собственную технологию обследования дорог по фотопанорамам. Наша главная задача — быстро собирать исходные данные на дорогах и обрабатывать их, а затем предоставлять заказчикам инструменты для эффективной работы с этими данными. Мы выполнили более 40 крупных проектов по всей стране в разных отраслях (организация дорожного движения, содержание дорог, наружная реклама, электросети). Еще мы поставляем Яндексу контент для Яндекс.Карт по десяткам городов (панорамы и реалтайм-данные о движении общественного транспорта). Сейчас продолжаем разработку web-based геоинформационной системы, в которой ведется основная работа над проектами, а также планируем заново написать сервисы для базовой обработки сырых данных. Есть много интересных идей, которые дадут нам возможность работать на новых рынках и предоставлять более качественные услуги, и нам нужны разработчики, которые помогут их реализовать. Что вы можете ожидать от работы:   Мы применяем   ES6, React, Redux   Webpack   Бэкенд: Python 3, PostgreSQL + PostGIS   Docker   Gitlab (включая Gitlab CI)     Мы уделяем много внимания качеству кода: пишем тесты и документацию, делаем ревью.   Практикуем парное программирование   Разработка организована по Scrum: планирование, 2-недельные спринты, ежедневные митинги.   У вас будет возможность выбирать те задачи, которые вам больше нравятся.   В команде есть разработчики, аналитик, тестировщик, инженер по поддержке.   Что мы ожидаем от вас:   хорошее знание JS (ES6)   знание React или Vue   знакомство с системами сборки   HTML5/CSS3   навыки написания тестов   опыт с Git   будет полезно знакомство с Docker и способность хотя бы читать код на Python   желателен опыт разработки в команде   способность быстро разбираться в незнакомых областях   умение самостоятельно доводить задачи до конца   Условия работы:   полный рабочий день   гибкое начало рабочего дня (с 9 до 13)   официальное трудоустройство   хорошо оборудованный офис рядом с центром города:   кофемашина со вкусным кофе, чай, печенье   холодильник, посудомоечная машина   настольный теннис   душ     рабочее место с современным компьютером и двумя мониторами   премия по итогам года   ежегодный пересмотр оклада   помощь с переездом кандидатам из других городов   Если вас заинтересовала наша вакансия - ждем ваше резюме, желательно вместе с примерами кода (например, ссылкой на репозитарий). Будем рады, если вы станете частью нашей команды!;Практикуем парное программирование. Разработка организована по Scrum: планирование, 2-недельные спринты, ежедневные митинги. Холодильник, посудомоечная машина. Помощь с переездом кандидатам...;ES6, React, Redux. Webpack. Бэкенд: Python 3, PostgreSQL + PostGIS. Docker. Gitlab (включая Gitlab CI). Хорошее знание JS (ES...;;"JavaScript;HTML5;CSS3;React;Git"
412;412;Frontend-разработчик (React);Москва;60000.0;120000.0;НОВАТОР;2019-12-02;2;От 3 до 6 лет;Полная занятость;Удаленная работа;В небольшой, но весьма эффективный стартап требуется Frontend разработчик на условиях full time удаленной работы.   В компании несколько проектов в разных сферах: управление автоматическими парковками, документооборот, системы визуализации и анализа данных, интеграция с VOIP и видео. Технологический стек UI на базе React. Серверная часть Java, Linux. В компании сильный упор на качественное автоматизированное тестирование всех видов (unit, интеграционное, нагрузочное). Наши системы обычно имеют архитектуру типа микросервисов, поэтому задачи обычно - дизайн и разработка веб части сервиса end-2-end при активной поддержке команды backend разработки. Требуется хорошее пониманием концепций html5, сильные навыки тестирования, опыт эксплуатации систем и ответственность за собственный модуль.   Обязанности:  Разработка новых информационных систем Поддержка и развитие существующих проектов  Требования:  Отличное знание HTML, CSS, JavaScript (jQuery, Ajax) Понимание принципов клиент-серверной архитектуры приложений Уверенное знание React и наличие опыта реализации сложных задач с его помощью Опыт работы с linux, работа из командной строки Умение читать документацию на английском языке Умение разбираться в чужом коде Опыт работы с системой контроля версия Git Опыт работы не менее трех лет, наличие выполненных проектов Знание bootstrap Привычки документировать код Опыт участия в разработке нагруженных проектов ;В компании несколько проектов в разных сферах: управление автоматическими парковками, документооборот, системы визуализации и анализа данных, интеграция с VOIP и...;Отличное знание HTML, CSS, JavaScript (jQuery, Ajax). Понимание принципов клиент-серверной архитектуры приложений. Уверенное знание React и наличие опыта реализации...;;"HTML;CSS;JavaScript;TypeScript;Linux;Git;Bootstrap;jQuery;REST;React"
226;226;Frontend-разработчик (React);Москва;;;IKIT Lab;2019-12-03;1;От 1 года до 3 лет;Полная занятость;Удаленная работа;"Мы создаем уникальные высокотехнологичные интернет-стартапы, с высокой посещаемостью и последними технологическими новинками. В нашей команде профессиональные ИТ-менеджеры и разработчики. Наша команда разработчиков в поисках коллеги для постоянного сотрудничества.. Мы предлагаем:  Сложные проекты и самореализацию; Удаленную, постоянную работу; График гибкий, есть возможность выбрать себе удобные часы работы, но не менее 8 часов в день; Оплату отпусков и больничных; Своевременную выплату з.п.  Что мы ждём:  Cовершенные знания HTML5, CSS3, JS Опыт работ с ReactJS Плюсом будет опыт работы на node.js      Мы ценим:  самостоятельность: вы умеете уточнить все вопросы по поставленным задачам, оценить задачи, спланировать, выполнить, протестировать и отчитаться о выполнении; грамотность в решении сложных технических вопросах; способность работать удаленно, создавать себе удобные условия работы, там, где Вам хочется быть в данный момент: в кафе, самолете, на пляже. ";Самостоятельность: вы умеете уточнить все вопросы по поставленным задачам, оценить задачи, спланировать, выполнить, протестировать и отчитаться о выполнении.;Cовершенные знания HTML5, CSS3, JS. Опыт работ с ReactJS. Плюсом будет опыт работы на node.js. Грамотность в решении...;;"JavaScript;HTML;CSS"
340;340;Frontend-разработчик (React);Москва;;;ДомКлик;2019-11-20;14;От 1 года до 3 лет;Полная занятость;Полный день;"Мы - продуктовая IT компания, финансируемая крупнейшим банком России. Мы – продуктовая IT-компания по созданию highload проектов в сфере недвижимости, финансируемая крупнейшим банком России. Мы отдельное от банка лицо, дочерняя компания, живем своей жизнью без бюрократических заморочек и разрабатываем платформу для решения квартирного вопроса онлайн — от заявки на ипотеку до регистрации права собственности. Работаем под брендом ДОМ КЛИК – это платформа для сделок с недвижимостью. ДомКлик.ру – единственный в России web портал, обеспечивающий полный цикл выбора квартиры, получения ипотеки, взаиморасчетов с продавцом и постпродажного сопровождения. 450 сервисов, 2000 запросов в секунду. Почему мы:  Интересный и без сомнений востребованный продукт. Вы сможете улучшить ипотеку одного из крупнейших банков как с точки зрения оптимизации прибыли, так и user experience. Мы используем современные технологии. Практикуем continuous integration и continuous delivery; код в bitbucket, задачи в jira и т.д. Взрослый девопс, highload. Бизнес-руководство, нацеленное на результат. Понимающее IT-руководство. Например, у нас есть квота 1 день в неделю на борьбу с тех. долгом/саморазвитие/рисеч/решение задач других команд. Высокие темпы работы, разработанные решения очень быстро попадают в продакшн.  Сейчас мы ищем разработчиков, которые вместе с командой:  Займутся разработкой компонентов React Будут анализировать и совершенствовать написанный код (code review). Постараются интегрироваться с Backend Разработают пользовательские интерфейсы мечты Спроектируют архитектуру приложения   ";ДомКлик.ру – единственный в России web портал, обеспечивающий полный цикл выбора квартиры, получения ипотеки, взаиморасчетов с продавцом и постпродажного сопровождения. ;Бизнес-руководство, нацеленное на результат.;;
603;603;Frontend-разработчик (React);Санкт-Петербург;;;Софтмашина;2019-11-25;9;От 3 до 6 лет;Полная занятость;Полный день;Привет! Софтмашина - молодая IT компания, занимающаяся разработкой различных продуктов и сервисов. На сегодняшний день ведется работа над рядом крупных проектов в областях туризма, транспорта и финансов. Мы строим компанию с человеческим лицом и создаем одну из лучших команд в России, где сотрудники для нас - самая большая ценность. Наше активное развитие и рост открывают большие возможности для приобретения нового опыта и построения карьеры внутри компании. Сейчас мы ищем Frontend разработчиков с непреодолимым желанием разрабатывать первоклассное программное обеспечение, совместно с командой единомышленников.   В этой роли предстоит:  Разрабатывать части SPA приложения на React Разрабатывать unit тесты (jest + react testing library) Верстать (material-ui, styled-components) Работать с чужим кодом Участвовать в code review    Для нас важны знания следующих технологий:  JS, HTML, CSS TypeScript React REST API Jest  Преимуществом будут:  опыт работы с material-ui или styled-components владение Redux, MobX или любым другим стейт менеджером знание Webpack    Мы предлагаем:  Заработную плату выше среднего по рынку Оформление в соответствие с ТК РФ и белую заработную плату Демократичные процессы, передовой стек технологий и никакого legacy Интересные задачи и работу с настоящими профессионалами Возможности профессионального роста и развития Дополнительное медицинское страхование Гибкий график и возможность частично работать из дома Комфортный офис в историческом центре Санкт-Петербурга   ;Разрабатывать части SPA приложения на React. Разрабатывать unit тесты (jest + react testing library). Верстать (material-ui, styled-components). ;JS, HTML, CSS. TypeScript. React. REST API. Jest. Опыт работы с material-ui или styled-components. Владение Redux, MobX или...;;"JavaScript;CSS;HTML;HTML5;TypeScript;React;REST API;Jest;Redux;MobX;Webpack"
1650;1650;Frontend-разработчик (React);Москва;;;WILDBERRIES;2019-11-11;23;От 3 до 6 лет;Полная занятость;Полный день;"Задачи:  Разработка новых разделов основного сайта; Разработка нового мобильного сайта Wildberries.  Необходимые навыки:  Отличное знание нативного JavaScript (в т.ч. ES6/ES7); Уверенное знание React; Уверенное знание: HTML5+CSS3; SASS/LESS; Опыт работы с одной из систем сборки: Gulp/Grunt, Webpack; Понимание основных принципов кросс-браузерной и адаптивной верстки; Опыт работы с системой контроля версий GIT.  Плюсом будет:  Знание TypeScript или Flow; Опыт работы на React/Redux стеке; Опыт разработки проектов с Server Side Rendering.  Мы предлагаем:  Сложные и интересные проекты; Возможности для профессионального развития и роста; Участие в конференциях, Meetups и Tech Talks; Позитивная атмосфера и дружный коллектив.  Офис в БЦ «Куликовский»  Просторный open-space с панорамными окнами в 5 минутах от метро; Социальная инфраструктура, прекрасный парк в пешей доступности; Современное «Железо» на выбор для эффективной работы; Мягкие зоны на этажах, релакс-зона на мансарде.  Корпоративные бонусы  Скидки на продукцию компании и подарки на день рождения, пункт самовывоза в офисе; Футбольный и волейбольные клубы; Утренние практики вместе с клубом WBYoga; Корпоративные скидки в фитнес-клубы рядом с офисом; Возможность гибкого начала рабочего дня; Компенсация обедов, фрукты и снеки, ароматный чай и кофе. ";Разработка новых разделов основного сайта. Разработка нового мобильного сайта Wildberries.;Отличное знание нативного JavaScript (в т.ч. ES6/ES7). Уверенное знание React. Уверенное знание: HTML5+CSS3...;;"JavaScript;React;ES6/ES7"
